TEAM NAMES,Series Number,Filename,Name,Description,Gender,Attributes,UUID,Hash
TEAM BEVEL,1,adewale-the-amebo,adewale the amebo,Adewale likes to be in everyone's business. ,Male,hair: bald; eyes: black; teeth: none; clothing: red; accessories: mask; expression: none; strength: powerful; weakness: curiosity,cad316c3-37f8-4b27-9f53-9d803bfcfee7,e74e2d3be663e89bcdbf153083a52cd0b1cf75084a0b14371ff1b6ef0f921dc3
,2,alli-the-queeny,alli the queeny,Alli is an LGBT Stan.,Male,hair: bald; eyes: white; teeth: none; clothing: yellow; accessories: mask; expression: none; strength: powerful; weakness: none,a57ecda4-a26f-4e97-a757-e1800af39aab,46867e43fb2fb6d9f7e4e5058ba9c5d803eef84765440a234abb4aa3a1204226
,3,aminat-the-snnobish,aminat the snnobish,Aminat never really wants to talk to anyone.,Female,hair: brown bun; eyes: none; teeth: none; clothing: yellow; accessories: glasses; expression: blank; strength: none; weakness: attitude,0e37ed0d-3e84-4f32-a91f-ec9c4ba8c7de,9e287faaca853c16bc89b0a8ce23bb3bcc73e1537e9fd79881d049c19d4710c4
,4,aminu-the-carpenter,aminu the carpenter,Aminu's hands are blessed; he makes the best furniture in the whole of Kano.,Male,hair: bald; eyes: blue; teeth: none; clothing: yellow; accessories: mask; expression: none; strength: powerful; weakness: none,4f30b751-96e7-40fe-97fd-e3d44973ff2f,b004a19158df3b57e420a04083ced9e13fb684c35af268c504f7910126d16cdb
,5,chibuike-the-kudibag,chibuike the kudibag,Chibuike is too rich. Everyone wonders how he got it.,Male,hair: bald; eyes: black; teeth: none; clothing: blue; accessories: mask; expression: none; strength: hustler; weakness: none,5ce854f2-7ac1-46fd-b3fe-57583935d1e5,016de301ea98792feac1bcec478c948f46e91a570788e289703fd9d4196de53f
,6,chidinma-the-model,chidinma the model,From Paris' runways; to London's streets; she's always in demand.,Female,hair: brown hair; eyes: none; teeth: none; clothing: multicolored; accessories: glasses; expression: none; strength: hardworking; weakness: none,c98db72e-49ac-4ca6-89d5-e00f5fbbcc45,b4988c14d7604d3865120b71bcfbb468818f7309d56e8967d280b77eddbf455a
,7,chioma-pretty- girl,chioma pretty girl,Chioma's face card is a 100.,Female,hair: dreads; eyes: none; teeth: none; clothing: multicolored; accessories: glasses; expression: none; strength: none; weakness: none,182ea888-a85b-42ca-ad73-ed4f8f9aa5c7,b37296854a7195a6e3dd689e5e777d740c2d7344247008bedf00605da66921bf
,8,damilare-the-handsome,damilare the handsome,He's a fine boy; proper eye candy. ,Male,hair: bald; eyes: white; teeth: none; clothing: yellow; accessories: mask; expression: none; strength: none; weakness: none,27eca2dc-d7df-474a-8f8f-1858152c711e,f881cea2c548d71f0e015ac2b965591a0a9d53cd49886f021c6849f26a4f2cbd
,9,ebiowie-the-planter,ebiowie the planter,Ebiowei has a reputation for nurturing plants.,Male,hair: bald; eyes: none; teeth: none; clothing: multicolored; accessories: none; expression: none; strength: powerful; weakness: none,f1df8270-4d60-4bd4-8959-ba7c384db5c4,e075632b22c788578c48232b69c1cd0086d54025fca2df36d8fc822d52d68a65
,10,emeka-the-businessman,emeka the businessman,Emeka only cares about containers. No time to waste.,Male,hair: bald; eyes: white; teeth: none; clothing: orange; accessories: mask; expression: none; strength: hard worker; weakness: none,9b3d75da-4887-4089-aee4-50de3954fdc9,852a23078d58f1f24389c6a4e04ec81bc9e6aa3f48962bef021bd4b42a386514
,11,gbeminyi-the-monk,gbeminyi the monk,He lives in a monastery off the coast. No one has heard him speak in years.,Male,hair: bald; eyes: blue; teeth: none; clothing: yellow; accessories: mask; expression: none; strength: none; weakness: none,c8b1fd1d-8551-4bb4-8dc4-923a9aeb39fb,8ee8000f972832bc617f2461dadc77f9b9ad6e52561c02f41c5de6de9b2bf1d5
,12,henry-the-sportsman,henry the sportsman,He's played every sport known to man. Even cricket.,Male,hair: bald; eyes: yellow; teeth: none; clothing: multicolored; accessories: mask; expression: none; strength: agility; weakness: none,e1225451-bfdf-4a1f-8d37-9cce3a0bd67b,3a9281c36fc4b43a470d6dc88e3d6e8d5cc4862586fdb31b930452b760fcbf78
,13,mayowa-the-smallie,mayowa the smallie,Mayowa is so small but everyone loves him still.,Male,hair: bald; eyes: blue; teeth: none; clothing: multicolored; accessories: mask; expression: none; strength: none; weakness: none,dfbb4163-df24-4d54-b74c-6218a68df8bd,c3ca0fea3f483da1f8c41fcaa890b620b2b1881849700c3c7b747da9d7342884
,14,muyiwa-the-stylish,muyiwa the stylish,Muyiwa has a motto which is never to be caught unfresh.,Male,hair: bald; eyes: ash; teeth: none; clothing: multicolored; accessories: mask; expression: none; strength: creativity; weakness: none,dcf9d5a0-57b7-4126-a05e-6c8f1045d3f7,a0bc80435de86dab7f0c273c061e7387f5e5c1bbb2f375448cabf584bd6130a0
,15,nina-paper-chaser,nina paper chaser,Nina loves money. It's all she dreams of. ,Female,hair: brown double bun; eyes: none; teeth: none; clothing: animal print; accessories: glasses; expression: none; strength: hustler; weakness: none,59524227-dc52-407c-8cca-e9e8c5fb3018,0c23ef12b6991881a711662b792cf76e46c2e6f190bf9aeaca73f9e3257c20d2
,16,oluwaseun-spicy,oluwaseun spicy,He loves spicy foods. He cooks pepper and sprinkles rice on top.,Male,hair: bald; eyes: black; teeth: none; clothing: yellow and purple agbada; accessories: mask; expression: none; strength: none; weakness: none,808f7007-6552-4efa-bd13-4b7c337b102b,023827d895fbc998102754fd312d0e805f008e96e7a08e44e3d73db97532bd3c
,17,sesan-the-smartie,sesan the smartie,Sesan always comes first in competitions.,Male,hair: bald; eyes: blue; teeth: none; clothing: orange; accessories: mask; expression: none; strength: intelligence; weakness: none,ba3edda7-8940-4ca4-97ba-826398d5909f,9a3ef157652c36154a68f7b534d03d60c0808386be08201c96581dfc4dc74519
,18,tiwa-london,tiwa london,If she says she's in London and you see her; you're in London too.,Female,hair: braids; eyes: none; teeth: none; clothing: black top; accessories: glasses; expression: none; strength: none; weakness: untruthfulness;,78da7aeb-8352-4e25-89ac-dc48b5984089,bbb14ed1ad0c39f8600b94dcf119393739d9de5835a858b8249cbca16e22990e
,19,tunde-yoruba-demon,tunde yoruba demon,Tunde derives joy in breaking hearts. It's a lifestyle.,Male,hair: bald; eyes: white; teeth: none; clothing: purple and yellow agbada; accessories: mask; expression: none; strength: none; weakness: promiscuity,53b46bd7-a537-402b-b249-0b4074a8faae,96940b5564c4f57e2f2df613b215fe7320b0f92842242132dff149922f90bdac
,20,yakubu-the-zombie,yakubu the zombie,Yakubu earned his zombie title because na only dust full him head.,Male,hair: bald; eyes: black; teeth: none; clothing: green and purple agbada; accessories: mask; expression: none; strength:none; weakness:slow to understand things,4adb6781-1614-424e-8f77-fe59ffca2209,cb59768458b92332439ebe936f6ed674ff79e5808f0d71eea4a85cda3ad17655
TEAM CLUTCH,21,abdul-the-vibe,abdul the vibe,Abdul the life of the party and can never be caught un-fresh.,Male,hair: none; eyes: black; teeth: none; clothing: purple and yellow kaftan; accessories: cap; expression: happy; strength: strong; weakness: no limitation,770f817a-9d9a-4772-9a91-e66dd9d03470,7a2d91888ddd243e79ced55d6d2344b86a17127984cc17e0b69db430c2e13d02
,22,emeka-the -clown,emeka the clown,Emeka the funny man; always making silly joke.,Male,hair: none; eyes: black; teeth: none; clothing: yellow and black ankara; accessories: cap; expression: straight face; strength: funny; weakness: little physique,78810fa6-a7ef-4d83-bf57-caf49db4ee69,7b4c3f1bc224d8fe5b1bfa738beffa87d994f6c845ec22457c674b0531ed3459
,23,salam-the-odogwu,salam the odogwu,Salam is a big time textile marketer always sourcing for quality materials.,Male,hair: none; eyes: brown; teeth: none; clothing: wine and yellow; accessories: yayada cap; expression: happy; strength: influence; weakness: impatience,f2957ded-022c-4b07-92c6-b345d4816a67,9e9e97fbbd3078190b025fe6c5e1ec6bbe103b72646428d4388991f0e19feb38
,24,charles-the-exporter,charles the exporter,Charles a business man an importer and exporter never to be caught idle.,Male,hair: none; eyes: grey; teeth: none; clothing: orange and blue; accessories: okpu ozo cap; expression: happy; strength: influential; weakness: incessant,09395e76-19ed-4852-8748-795ee7496a8e,4a49b5482e2370f4f7dd33e50cd74d21799b034d725f03248989b0f95a54e379
,25,wole-the-pimp,wole the pimp,Wole knows people and his way around his city.,Male,hair: none; eyes: black; teeth: two white teeth with diastema; clothing :yellow dashiki; accessories: yori yori; expression: happy; strength: strong; weakness: promiscuous,4d94d4f7-9b69-4e43-9db1-1fe83df92857,e78b0d89f4d82202b118f8ec9d304332ddbd0b3efa2170069f2caf5f8efe528c
,26,saro-the-baller,saro the baller,Saro is a baller and he is always ready to turn-up,Male,hair: orange afro; eyes: blue; teeth: two white teeth with diastema; clothing: black and yellow kente; accessories: none; expression: angry; strength: strong; weakness: insatiable,d35a7514-8996-42fb-a5f2-5a603ec679c5,4ddc42f75fd5bc9f7b34d46cf5bb1974daaec0cca839402482be8a54df23734a
,27,ade-omo-yoruba,ade omo yoruba,Ade is an influential man and he is revered in his town.,Male,hair: none; eyes: blue; teeth: complete white teeth and a gold tooth; clothing: black and yellow kente; accessories: wine cap; expression:happy; strength: hardworking; weakness: procrastination,92984fa0-310b-4377-8a10-15965d044383,668d05588bfea0c343ce9ad5a9e3f191ec07a0544eedce794bf99a8237f5b716
,28,shola-cool-kid,shola cool kid,Shola prefers to be alone because he hates stress.,Male,hair: none; eyes: none; teeth: none clothing: yellow t-shirt and blue dongaris; accessories: red facecap; expression: playful; strength: fun; weakness: playful,3ac5c186-bc14-4eb6-8567-cc818465a64f,36fc925d6d25e4cc3677a0ed4703ddfab9d12e98ca532481a589ea35942f3534
,29,charlie-the-smoker,charlie the smoker,Charlie uses smoking as a coping mechanism.,Male,hair: none; eyes: black; teeth: none; clothing: black shirt with lion prints; accessories: blue cap; expression: happy; strength: nice; weakness: gullible,71a0aa22-d111-43b7-8484-43d87310bc42,bbfcc4b5c8ee018ec612c7c673572215bd7e2bd817f5a2843e532dae63ae1263
,30,femi-the-badguy,femi the badguy,Femi is one of the fliest guys in Lagos.,Male,hair: orange; eyes: black; teeth: none; clothing: white t-shirt and blue dongaris; accessories: smoking pipe; expression: unbothered; strength: fearless; weakness: intolerance,e493e3fb-a8a0-455a-854f-0f6474bbc69f,a4e806379df313389866ffb61099f489157884ab4a5adce6711413a3fa95c00e
,31,sinzu-money,sinzu money,Sinzu loves spending money on flashy things.,Male,hair: none; eyes: blue; teeth: white complete teeth and a brown tooth; clothing: purple and yellow kaftan; accessories: green-stripped fila cap; expression: strength; strength: generous; weakness: aggressive ,942f8347-9932-4331-bd15-d0f3a048b54f,ae90c938881652d68e5f69b058718604d55be70757a73f947093533eeee4d23a
,32,obinna-the-palmwine tapper,obinna the palmwine tapper,Obinna taps palmwine for a living.,Male,hair: none; eyes: black; teeth: none; clothing: yellow black and a touch of pink ankara; accessories: cap; expression: happy; strength: contentment; weakness: naive,0f1af056-2548-4407-bed4-abc11deae05d,9931a24dcf38092d90f385316dd7e8d42086302ca82978aa0f0ddd4476abe935
,33,aminu-maikudi,aminu maikudi,Aminu is a wealthy man from a family with generational wealth. ,Male,hair: none; eyes: black; teeth: none; clothing: maroon and yellow agbada; accessories: cap; expression: unbothered; strength: confidence; weakness: selfishness,0129e7a5-e3d0-4675-92d0-1a1e55d11612,fbc2ae0a7acf2e32e41436013e8528d70a2978bbe25f96b706a2a4eff700da65
,34,sabinus-the-town crier,sabinus the town crier,Sabinus delivers messages to his town people.,Male,hair: none; eyes: black; teeth: two white teeth with diastema; clothing: orange ankara with touches of blue; accessories: cap; expression: happy; strength: dexterity; weakness: impatience,01d4ce96-818e-44b1-8813-68a7d34b35ba,dff0becda7745cccd69a695a3eef1ec30bc52d6bbfd5b55d258fc418f6b64e6d
,35,adisa-ibadan,adisa ibadan,Adisa is an elegant man and he is adored by his people.,Male,hair: none; eyes: black; teeth: none; clothing: kente; accessories:abeti-aja cap; expression: mischievous; strength: independent; weakness: bossy,3a925f27-35f6-4dbf-9960-c6527fae5f3e,7a88df1f1f38da9962dd5c41ef80b22c27ec670e80ff8f03b3d4c8f6c1abcdc8
,36,linda-the-navigator,linda the navigator,Linda knows how to make a way for herself and the people around her.,Female,hair: blonde; eyes: none; teeth: none; clothing:multicolored; accessories: glasses; expression: confused; strength: creative; weakness: insecure,71f335a6-5a4f-4410-9cea-179336f0e498,4ad061f5c92353fcc386f521046a843d54073b2103cd7dc8ebf5f20a95ee9a5e
,37,kemi-the-iron lady,kemi the iron lady,Kemi the strongest woman known to the town of Igbede people.,Female,hair: ginger; eyes: none; teeth: none; clothing: ankara; accessories:glasses and a pipe; expression: cool; strength: disciplined; weakness: perfectionist,35b11a31-5b92-49f4-8fb1-30f255d22054,8d69d9c1868b2dee0bc3017a60a28325372b67a23010d78c8707bf6a40862590
,38,mercy-the-sassy lady,mercy the sassy lady,Mercy is a confident woman and never hesistate to show it.,Female,hair: brown; eyes: none; teeth:none; clothing: ankara; accessories: glasses; expression: sassy; strenght: creative; weakness: sensitive,7a3c70ac-927f-4a63-a3df-ab86dd27cd0f,235efaecf07dccc32a0cc8ec20c8ae2ebc7bdc3d58020b0b1693c9713e5826d2
,39,sandra-money,sandra money,Sandra likes getting and spending money.,Female,hair: brown; eyes: none; teeth:none; clothing:yellow and black; accessories: glasses; expression: confused; strength: brave; weakness: overthinker,1bd95fb0-7b2e-4354-bebd-22f9cf70a1ca,7752106d2b97d73140e445f8ec9e0d524fc3ac36d80cc6827fe16936b517094e
,40,bimpe-the-fashionista,bimpe the fashionista,Bimpe loves wearing trendy clothes and looking gorgeous.,Female,hair: blonde; eyes: none; teeth:gap teeth; clothing: black cold shoulder shirt; accessories: glasses; expression: shocked; strength: intelligent; weakness: procrastination,92b548b7-998b-46b6-8198-80d407209483,4d49bd226a55e9e6522d46b4f192dec9a5bbb54dfdba337aa417e2d04b28bbb6
TEAM ENGINE,41,kim-rich-aunty,kim rich aunty,She loves spoiling her nieces and nephew.,Female,hair: pink; eyes: brown; teeth: none; clothing: ankara; accessories: none; expression: smiling; strength:brave; weakness:food,3344a73c-f15e-4afd-a1b2-3199e27eb08f,cf1a18115c35fe612815c0c37aaaf90ccb844e1d1a4a767bb37cedce6b110cf5
,42,barbra-stark,barbra stark,She loves fine dining and spends time with family.,Female,hair: blue; eyes: brown; teeth: none; clothing: ankara; accessories: none; expression: smiling; strength:brave; weakness:food,4f31fd99-4918-42a9-a112-fa60ef36d5c6,5f611b38353202d80d1f5303ed6a5056251c9eb5a68ce18cf97492c4ef129f59
,43,jean-art-dolger,jean art dolger,Loves collecting art for charity.,Female,hair: blue; eyes: brown; teeth: none; clothing: ankara; accessories: none; expression: smiling; strength: creative; weakness: food,5e1105d9-e485-462d-a5bf-1eb931976b13,964f03e04f37629e870219d33dbc63aea99c490a38b877f22e836f7a47f40421
,44,flora-burger- eater,flora burger eater,She loves eating burgers.,Female,hair: blue; eyes: brown; teeth: gap; clothing: stripes; accessories: none; expression: frowning; strength: prayerful; weakness: food,054dffd1-cdff-417b-b6c2-a679dabd087b,77861b814e325e0b42e62adea66eea65e8a602b8ea82963c198abbcdd52c3e79
,45,jessie-lord-rings,jessie lord rings,She loves her  (precious) jewelry.,Female,hair: blue; eyes: brown; teeth: none; clothing: satin; accessories: none; expression: smiling; strength: kind; weakness: shy,caacabe1-0abc-43af-92e2-2231248bff93,c06e6abe8df4171f03b5849dbbe06df851a4d96e754f2d7e3e2adf406fd00d13
,46,pinky-monky-ponk,pinky monky ponk,She love to dance the honky tonk.,Female,hair: maroon; eyes: blue; teeth: none; clothing: linen; accessories: none; expression: smiling; strength: brave; weakness: chips,bd6a4b38-543e-40fa-9153-f7e1a947ebb1,310fee8d482cc331f8c4b8e955984729642cae889288d36f31f04c4069050a22
,47,wanjiru-hippie-glitter,wanjiru hippie glitter,A hippie that loves her glitters.,Female,hair: blue; eyes: brown; teeth: none; clothing: wool; accessories: none; expression: smiling; strength: none; weakness: babies,683f0d27-3cb4-4948-b1b5-09f10bee575a,1275aca4fa145851f55000523aed3b1b699866871ca3e8c54f6525b683a8974e
,48,njoki-binary-coder,njoki binary coder,She codes with the best language and tops the set.,Female,hair: blue; eyes: brown; teeth: none; clothing: ankara; accessories: none; expression: smiling; strength: none; weakness: none,9b59bdb4-0c6c-4107-9d72-6d38d308edb4,3bd6303376f2d33c20bdf4a387a5bae012bc4b400435d2b2652c64f9e1365132
,49,wangu-calaba-hustler,wangu calaba hustler,She is a passionate hustler you should be careful with her.,Female,hair: blue; eyes: brown; teeth: none; clothing: ankara; accessories: none; expression: smiling; strength: brave; weakness: flying,67f7da93-3925-4def-b660-58f558c14a19,49e3e3661af925287d5494a7ff40a486add3cfd4089047a9b608aacad3225231
,50,lulu-dey-kpako,lulu dey kpako,She's is as enthusiastic as she is beautiful.,Female,hair: blue; eyes: brown; teeth: none; clothing: ankara; accessories: none; expression: smiling; strength: loving; weakness: makeup,23b6c38f-ab84-4565-bfe9-d9eb019c9f29,79e803a13f7cc90bec64a5a6ce069a49a2ec41568dd1cfd05799f5661bcf9a55
,51,kiki-cala-flier,kiki cala flier,She flies first class and gets the best deals.,Female,hair: blue; eyes: brown; teeth: none; clothing: ankara; accessories: none; expression: smiling; strength: brave; weakness: kittens,d24aefff-c9fc-4ea9-a7cf-1b741076c822,77ee7f1881a25a87d029bbd714bf987602c77fdc454abfea54a3bb7bec6684cb
,52,purity-nft -investor,purity nft investor,She is an angel investor looking for the next big thing.,Female,hair: blue; eyes: brown; teeth: none; clothing: ankara; accessories: none; expression: smiling; strength: brave; weakness: clothes,ee86ef77-4793-411a-88d3-ea54d84f6b24,2d5fed50643969dcd990566ebfefc975d78757d8aa8c909a10edbda1d65d9bf7
,53,june-binary-monk,june binary monk,She has a twin from Tibet and they always play together .,Female,hair: blue; eyes: brown; teeth: none; clothing: ankara; accessories: none; expression: smiling; strength: brave; weakness: money,102c4cdb-f812-44fd-bf47-5065284c6075,4aafd52e3b6b3f8fd6b72475518e3d9a98f0ca3e4dfecf644b63f4bd7a9ef248
,54,aisha-flying-damsel,aisha flying damsel,She is always a damsel in distress and loves to fly.,Female,hair: blue; eyes: brown; teeth: none; clothing: ankara; accessories: none; expression: smiling; strength: brave; weakness: food,c4071af3-b49e-4ad6-898b-7828f90465fb,25d19c347fc3e4db5d920c2b04cfda8f9cb60f8af512cde662f21e30d0a04895
,55,bobo-crypto-lovely,bobo crypto lovely,She is a crypto guru you can trust all through.,Female,hair: blue; eyes: brown; teeth: none; clothing: ankara; accessories: none; expression: smiling; strength: brave; weakness: water,427ea0f5-30a3-4d70-a5bd-a6106409b83c,02596eec03a34adfca76513ece05f5ef6010248c1636b763d55d058d366e96f3
,56,nell-light -embrace,nell light embrace,She is an empathy ready with a kind word or hug.,Female,hair: blue; eyes: brown; teeth: none; clothing: ankara; accessories: none; expression: smiling; strength: brave; weakness: love,9dfe30b4-c71a-471c-8091-f5c4a238eed8,99bd3b7d93c10e5c93b024363d1ecccef8a76ecad6e370ffc75c6be7024b4cc8
,57,rachel-mood-silent,rachel mood silent,Introvert  to the core a mysterious lady.,Female,hair: blue; eyes: brown; teeth: none; clothing: ankara; accessories: none; expression: smiling; strength: brave; weakness: walls,11450acd-f0d7-406f-bc18-bdb680404845,5d4455a4b019d58c2ff71afd38a5861db5921e6243055d98cb1d2837491a9672
,58,nana-reflector-agent,nana reflector agent,She loves her chrome fashion style.,Female,hair: pink; eyes: blue; teeth: none; clothing: ankara; accessories:none; expression: smiling; strength: brave; weakness: shy,63bda633-bfca-4b28-823f-7772936b4103,6710681fcabda6dff6b195cb319bf0196b1f6485600e70d98b9bb77d8d124edf
,59,bree-busy-gossip,bree busy gossip,Never whisper your secrets to her except you want the world to know.,Female,hair: blue; eyes:white; teeth: none; clothing: glitter; accessories:none; expression: frowm; strength:goodlistener; weakness:height,4f5898d9-fc99-4053-a56c-b2ec1ef41347,fbbed873817cc999b23defc94dc3fc42877d4eecd69e8d35ed14cb8948c33777
,60,jude-shadow-fighter,jude shadow fighter,A ninja warrior; the last samurai standing.,Female,hair: white; eyes:brown; teeth: none; clothing: ankara; accessories:chain; expression: smiling; strength:brave; weakness:water,a47b2ed7-d4aa-4404-ac40-0ecea464cf3f,35e9095deae572722b3afdd1612b4ac3aa89a04641b2384deeb92d7b3da596cd
TEAM GRIT,61,toy-soldier,toy soldier,A man stronger than an army.,Male,hair: bald; eyes: closed; teeth: none; clothing: overall; accessories: nose mask; expression: happy; strength: powerful; weakness: sentimental,fc8ea3ac-59d1-11ed-9b6a-0242ac120002,c89dadd880457a7acb21ba080cc2efa0411190380df33984557789f13ea58124
,62,pipey-rivers,pipey rivers,A man who loves the water so much and fixes it's path.,Male,hair:bald; eyes: opened; teeth:none; clothing: overall; accessories: nose mask; strength: calculative; weakness: public speaking,58f69cae-59d1-11ed-9b6a-0242ac120002,3ee0321e76c398354749ef535b4aeaa05b0643865ed3dbead73ed6ae0ca3901e
,63,phiri-of-zambia,phiri of zambia,An african woman with strength and beauty.,Female,hair: purple buns; eyes:nose; teeth: none; clothing: adire; accessories: sunglasses; expression: jiggy; strength: free spirit; weakness: blind ,24b537fa-59d3-11ed-9b6a-0242ac120002,7c31bcb5a7d2e3b143fb6e0076c080f30f0b18527bdff83f9298dfcbb6ca3d83
,64,patrick-of-bikinibottom,patrick of bikinibottom,A white man who loves the african culture and associates with their dressing.,Male,hair: bald; eyes: opened; teeth: none; clothing: kente; accessories: nose mask; expression: confused; strength: adaptation; weakness: fluency,064c7b84-59d3-11ed-9b6a-0242ac120002,a9fd53e2bc0ce79ae5824590ca8ca304c66b673b7847ba18f7bb67ce07c58f05
,65,nobuhle-of-zulu,nobuhle of zulu,A woman; well endowed with beauty.,Female,hair: brown bun; eyes: none; teeth: none; clothing: iqoyi; accessories: sunglasses; expression: astonished; strength: cool headed; weakness: pressure,1ee5b1ce-59d3-11ed-9b6a-0242ac120002,e03686e0732e463b385bcc74a0263905094ddbf44521abd6f67ff1c218ba3b16
,66,nkosazana-of-xhosa,nkosazana of xhosa,An african princess; always proud of her culture.,Female,hair: ginger afro; eyes:none; teeth: gap teeth; clothing:umbaco; accessories: sunglasses; expression: fufilled; strength: confidence; weakness: endurance,2f1a1724-59d3-11ed-9b6a-0242ac120002,498c6c1378f8765f9f79defd83e18637c1be7c0c0d5628ee16fae2e5cfe44c93
,67,mandla-of-zulu,mandla of zulu,A simple and introverted guy who keeps to himself.,Male,hair: bald; eyes: opened; teeth: none; clothing: eshowe; accessories: nose mask; expression: irritated; strength: strong willed; weakness: relationship,d04553b2-59d7-11ed-9b6a-0242ac120002,b3b2e44d4cf76295d553847cc22ada5756e310e4f84c37723364153663fa97b5
,68,john-doe,john doe,A principled guy who is conscious of his health and ensures protection from infection.,Male,hair: bald; eyes: opened; teeth: none; clothing: ankara; accessories: nose mask; expression: cold; strength: cleaniness; weakness: perfectionist,5d19795e-59d2-11ed-9b6a-0242ac120002,fdde33f6a446d47417db02ca545a37b45348edb482e684d32cbc8ead43a6c2bd
,69,ghost-of-power,ghost of power,A woman; stronger than ten men combined.,Female,hair: black tied with scalf; eyes: none; teeth: none; clothing: iqoyi; accessories: sunglasses and pipe; espression: ruthless; strength: badass; weakness: cancer,29c764ca-59d3-11ed-9b6a-0242ac120002,48c01583c2eabca4c5f43a925e627751f160eb6ed5a28d0d89fecd25e62ea3bd
,70,freida,freida,A man who is always peaceful.,Male,hair: bald; eyes: closed; teeth: none; clothing: overall; accessories: nose mask; expression: calm; strength: peaceful; weakness: anger,ee671c4a-59d2-11ed-9b6a-0242ac120002,a89db0f1831ab4bcbb6678b483b0e19de9af0766702c1667e5cb9f1b02d96a54
,71,flamboyant-tree,flamboyant tree,A beautiful african woman; billionaire in the making.,Female,hair: one bun dark brown; eyes: none; teeth: none; clothing: kente; accessories: sunglasses; expression: happy; strength: beauty; weakness: lover girl,380e4990-59d3-11ed-9b6a-0242ac120002,8a8d01521afd5e8276656742407a2dd0986318448c522be6555346791c8c269a
,72,david-of-accra,david of accra,A combatant who fights and defends his people,Male,hair: bald; eyes: opened; teeth: none; clothing: kente; accessories: nose mask; expression: angry; strength: super powerful; weakness: sleeping,1c1ef1b4-59d1-11ed-9b6a-0242ac120002,4c987ca73232315f2a2b181b08b8c2fd74bd7549f4511f7b1e145323db03bd7f
,73,cally-lily,cally lily,A man who is a breathe of fresh air.,Male,hair: male; eyes: opened; teeth: none; clothing: overall; accessories: nose mask; expression: confused; strength: calm; weakness: sun,82bba87c-59d1-11ed-9b6a-0242ac120002,1b6c99fac5a92cfca0f037c9c3d0989d8cfa18f150867ad87dcb51de69d4f0c1
,74,bubune-of-accra,bubune of accra,A man with honor; always conscious of his health.,Male,hair: bald; eyes: closed; teeth: none; clothing: kente; accessories: nose mask; expression: happy;  strength: clean; weakness: foodie,faa4b530-59d2-11ed-9b6a-0242ac120002,b39363e5c1ec174cc30d6b31c82c5124058f8934c0dda88ad0aaa2155b1e1bfd
,75,bediako-of-accra,bediako of accra,A strong man; always ready to fight for what is right.,Male,hair: bald; eyes: opened; teeth: none; clothing: balck with kente; accessories: nose mask; expression: suspicious;  strength: activist; weakness: irrational,fb6e8222-59d0-11ed-9b6a-0242ac120002,21cf592964c23af740b17a4e5b910827098a4406b17c66e942496b849a60c7c1
,76,avatar-aang,avatar aang,A man who is ready to save the world.,Male,hair: bald; eyes: opened; teeth: none; clothing: kaftan; accessories: nose mask; expression: soothing; strength: mind games; weakness: insomia,169f93a0-59d2-11ed-9b6a-0242ac120002,724706526827d59ec6ecf0d20e07ff41ededd91c9f2a21115ef717b5795e2919
