TEAM NAMES,Series Number,Filename,Name,Description,Gender,Attributes,UUID,Hash
,300,tamuno-the-prince,tamuno the prince,An Ijaw prince who is also the heir to the throne,Male,hair: covered; eyes: sky-blue; teeth: closed; clothing: akan;  accessories: cap; expression: straight-face; strength: caring; weakness: easily deceived,108447d1-f2d5-4816-8ebb-599286c3fabf,ed4d6a9c8ea6614abe2cee3595d02fdb65f9fae826b0ce7200a3b45f5d1d647f
TEAM SCALE,301,wendy-the -banker,wendy the  banker,"Wendy loves working in the bank, as she gets to meet different people.",Female,hair: dark red; eyes: blue; teeth:none; clothing: blue and yellow ankara; accessories: none; expression: shocked; strength: none; weakness: none ,587645e2-5ace-11ed-9b6a-0242ac120002,459793c76fedf73ad4f5f404ae7aad5fe9941c92f2f3ae04d27d11903f370e76
,302,uduak-the -dark horse,uduak the dark horse,Uduak looks innocent and has the whole apartment bugged,Female,hair: brown; eyes: blue; teeth:none; clothing: multi-colored ankara; accessories: none; expression: witty; strength: none; weakness: none ,58764862-5ace-11ed-9b6a-0242ac120002,5714a00a3ecd8b027d791dfdf92dd909026e374b51c38d10ff162513bee55b89
,303,timeyin-the -eccentic,timeyin the eccentic,Timeyin is as eccentric as they come with no care for others opinions,Female,hair: brown; eyes: blue; teeth:none; clothing: multi-colored ankara; accessories: smoking pipe; expression: high; strength: none; weakness: none ,58764a2e-5ace-11ed-9b6a-0242ac120002,2f2c97e4ad6ca80a3f948cf38e5f99eec485b1c456d7e23ba37b865836699371
,304,omawunmi-the -businesswoman,omawunmi the businesswoman,Omawunmi is a no-nonsense woman with a shop in idumota,Female,hair: pink; eyes: blue; teeth: white teeth; clothing: yellow ankara; accessories: none; expression: angry; strength: none; weakness: none ,58764b78-5ace-11ed-9b6a-0242ac120002,ee4b1defcff9026638a478f769db2c258f39b0fb14f7e321ac65cf9ff116cc1f
,305,halima-the-housewife,halima the housewife,Halima loves to bake and cook for her children,Female,hair: brown; eyes: blue; teeth: none; clothing: ankara designed with yellow red and green; accessories: none; expression: tired; strength: none; weakness: none ,58764d8a-5ace-11ed-9b6a-0242ac120002,9f838d89f2b1b363fa228c7e48a8222103166fe0b192b14aafe9011050889c80
,306,muna-the -block sister,muna the block sister,Muna loves to tell everyone in the block about her younger escapades,Female,hair: black; eyes: blue; teeth: none; clothing: wolf skin ankara; accessories: headgear; expression: shocked; strength: none; weakness: none ,58764ea2-5ace-11ed-9b6a-0242ac120002,5ca7c34319fee7d60dbf15d77ef7f65e08d015f49d88875078a1336351a0e39f
,307,stella-the -gossip,stella the gossip,Nobody gossips on the block like stella when smoking.,Female,hair: red; eyes: covered eyes; teeth: none; clothing: black ankara with bright design; accessories: none; expression: calm; strength: none; weakness: none ,58764fd8-5ace-11ed-9b6a-0242ac120002,d08d6082ca24604629a77377c3e20bb35bcfa8dea7c2a715f9d5b5f8eaf830f4
,308,agbani-the-wannabe,agbani the wannabe,Agbani loves to shop antique decorations for her mansion in idi-iroko.,Female,hair: purple hair; eyes: covered eyes; teeth: none; clothing: blue one-armed dress; accessories: none; expression: happy; strength: none; weakness: none ,5876542e-5ace-11ed-9b6a-0242ac120002,70687e38ac968ed9a2785be3ad9eec1db056f6e81bd022f551a24145434d88bb
,309,asante-the -warrior,asante the warrior,Asante came from a long line of warriors in Ghana.,Female,hair: pink braids; eyes: covered eyes; teeth: none; clothing: one-armed brightly colored dress; accessories: none; expression: calm; strength: none; weakness: none ,58765578-5ace-11ed-9b6a-0242ac120002,7ecefcb7a18e0a2fa9f3fdf5360a6002d1ca871dcca61557ca4bca721893882b
,310,hilda-the -insomaniac,hilda the insomaniac,Hilda prefers to sleep during the day.,Female,hair: pink; eyes: covered eyes; teeth: none; clothing: multi colored ankara; accessories: none; expression:calm; strength: none; weakness: none,5876569a-5ace-11ed-9b6a-0242ac120002,af87e987a1f078cc00cab2b085566af19fd26ba6686ccb7e7cca7a72cff9ae27
,311,sisi yemi-the -street aunty,sisi yemi the street aunty,Sisi Yemi is everyone's favourite street aunty.,Female,hair: dark brown; eyes: brown eyes; teeth: none; clothing: blue and yellow ankara; accessories: none; expression: shocked; strength: none; weakness: none ,587657a8-5ace-11ed-9b6a-0242ac120002,bb8226d7152b3f406cab075e7977d4b1d7e67c778fef8b6553bbf3bdb7b6a849
,312,chiamaka-the -bully,chiamaka the bully,Chiamaka hates people in her business and likes to scare the kids on the block,Female,hair: pink  eyes: brown  teeth: none  clothing: multi-colored ankara  accessories: smoking pipe  expression: strong  strength: none   weakness: none ,587658ca-5ace-11ed-9b6a-0242ac120002,aaa7eb922607f94c26a21924afd7b375372a225c5e678a207d019bd52ba1711a
,313,gift-the-fashionista,gift the fashionista,Gift has always been bold and that spreads to her fashion sense too.,Female,hair: brown   eyes: brown   teeth :none   clothing: multi-colored ankara  accessories: none  expression: witty  strength: none   weakness: none ,58765adc-5ace-11ed-9b6a-0242ac120002,40493c9a0bdd748e0bd93c80ceb1d9750f3278871ef56bb1e32448625ff23490
,314,omoyene-the-weirdo,omoyene the weirdo,Omoyene likes to murmur to herself and talks about seeing ghosts,Female,hair: brown  eyes: brown  teeth: none  clothing: yellow ankara  accessories: none  expression: calm  strength: none  weakness: none ,58765bea-5ace-11ed-9b6a-0242ac120002,93702488fc5a4d506f7863261ed31dbe4fd97a13e8b56b76eff4684416311d83
,315,maria-the -freshface,maria the freshface,Maria likes to believe the world is sunshine and rainbows while blowing gum,Female,hair: pink  eyes: brown eyes  teeth: white teeth  clothing:yellow; greem and red ankara   accessories: none  expression: furious   strength: none   weakness: none ,58765d02-5ace-11ed-9b6a-0242ac120002,7de0402defe97d30290b5656d0c1d4aeb720270d0fb14c466c601db3111e4ff2
,316,monica-the -smoker,monica the smoker,Monica is never found without a pipe and loves to interject in every conversation.,Female,hair: grey   eyes: covered eyes  teeth: none  clothing: black ankara with bright designs  accessories: yellow glasses  expression: hip   strength: none   weakness: none ,58765e24-5ace-11ed-9b6a-0242ac120002,cbd4ebc11968f4a8a7aed27491f86e5df6097d2a97c2109e84c824435550fce0
,317,janet -is always -found singing ,janet the singer,Janet is always found singing in whatever activity shes doing,Female,hair: purple   eyes: covered eyes  teeth: none  clothing: yellow and blue ankara  accessories: yellow glasses  expression: cool  strength: none   weakness: none ,cef902bc-5afc-11ed-9b6a-0242ac120002,b8b7b01ecde4d8664dd6b5065ef23472e30978d0891b5b17633089a04a83c8e7
,318,emi-the-reggae-girl,emi the reggae girl,EMi is a beautiful dancer; she rules the reggae world.,Female,hair:pink braids   eyes: covered eyes   teeth: none  clothing: multicolored ankara  accessories: yellow glasses  expression: happy  strength: none   weakness: none ,cef9060e-5afc-11ed-9b6a-0242ac120002,90e43fb12e67e2eabb04db917485aa62dc3bcedf0a7ea39605616b2331496aa7
,319,aisha-love-the-life-of-the-party,aisha love the life of the party,Aisha always party during the weekend,Female,hair: red   eyes: covered eyes  teeth: none  clothing: wolf-skin ankara  accessories: yellow glasses  expression: hip  strength: none   weakness: none ,cef907a8-5afc-11ed-9b6a-0242ac120002,dfda94f8cc87c671a8d4c29213591be1c15e850da594a303ce19a7cf767754c8
,320,amaka-the-tailor,amaka the tailor,She sews the most beautiful dress in the hood,Female,hair:grey  eyes: covered eyes   teeth: none  clothing: black dress  accessories: yellow glasses  expression: happy  strength: none   weakness: none ,cef9091a-5afc-11ed-9b6a-0242ac120002,3b1071ad25e668fafb7bd180b2c95617f437b305e03fb8fc291e68f2d808721a
TEAM SANDPAPER,321,omunyinyi-the-stoic,omunyinyi the stoic,omunyinyi wears a Kitenge coat,Male,hair: bald eyes: tearyteeth: noneskin: brownskinclothing: checked ankara accessories: none expression: teary strength: powerful weakness: self-loathing,c2d6a3ac-1d4d-4268-ba7f-4f0f8f50c1ab,2760c7cb6bdac40f80e1b517c23ae25d5d4ae718e20f9b9b44feac7e68925000
,322,kamau-the-sleeper,kamau the sleeper,closed eyes meditating,Male,hair: blad eyes: closed teeth:  noneskin: brownskin clothing: black ankara accessories: none expression: flat strength: open to suggestion weakness: always sleepy,20330f5c-40c2-4f6a-b9d8-d1d04fb97daf,f28e039bcbc3485c81c0c005d10f07295752c2edd99bc7225d20d0b8af308f76
,323,mutiso-the-lastborn,mutiso the lastborn,masked up mutiso dozing off,Male,hair:bald;; eyes: closed teeth: none skin: brownskin clothing: yellow ankara accessories: none  expression: tired strength: consistency weakness: pessismist,0706c338-42eb-4d26-84ea-c24b39628200,6f02febb554a0c54d5c47f590b3ea4fea5f2cfdeed76bb37e7a7389bb7f4412c
,324,omondi-the-vegeterian,omondi the vegeterian,omondi wears a green coat,Male,hair:bald; eyes: sharp eyed teeth: none skin: brownskin clothing: green ankara accessories: none expression: alert strength: leader weakness: anxious,bfb5e8d5-d7a7-4aa8-85e8-d7d9afd4adb3,714680764651b02864c273f45e45d9fcbf4f149744070b7706200590963da5a9
,325,barasa-the-optimist,barasa the optimist,looks up to the sky and makes a wish,Male,hair: bald; eyes: blue teeth: none skin: dark skin clothing: brown ankara accessories:none expression: awake strength: strong willed weakness: immoral,2da4bef4-38cc-4414-99ad-7361fac04b2b,dc83e75c4d2fe5548ac0424daea27c7d6a50bb2c9ec64ce179f8e556e9b454d1
,326,mwembu-the-elder,mwembu the elder,"old but not so old, with yellow his favorite color",Male,hair: bald; eyes: black teeth: none skin: dark skin clothing: dark ankara accessories: none  expression: plain strength: fulfilled weakness: angry,36181230-6ac9-417f-af5c-23bdd2c25ecb,dddbbf30d78c3e58ae522a2039ce226bb20903772285bc754a2110554413bdde
,327,mbogi-the-fighter,mbogi the fighter,masked up mbogi after capture,Male,hair: bald;eyes:  blackteeth: noneskin: darkskin clothing: onesideankara accessories: noneexpression: willfull strength: fighter  weakness: rebellious,3a7bc3c4-1463-42ce-84c9-07337da64435,eb63a96229b7cabe560471078d43ed69a75062e8faa99345141cae8627febb06
,328,mrosho-the-runner,mrosho the runner,masked up mrosho,Male,hair: bald; eyes: sea blue teeth: none skin: darkskin clothing: purple ankara accessories: none expression: alert  strength: visionary  weakness: destructive,b2ca2c76-3b6d-43f1-8cc9-089b6ab83876,3bc266f0181f31dc2c4b438e4232d0ebe065eb41dfd5615b1f38b789616e6b67
,329,milele-the-african,milele the african,milele with a nice african print in orange,Male,hair: bald; eyes: blue teeth: none skin: dark skin clothing: orange ankara accessories: none expression: timid strength: leader weakness: failure,644b0259-d75c-456d-934c-ce7c052bad3a,cf9ef84aa878d992f0f387c759dd4d6602b0571ed5caa933067c32070de1feda
,330,olebon-the-oloibon,olebon the oloibon,olebon in customized buba sokoto,Male,hair: bald; eyes: closed teeth: none skin: darkskin clothing: animal print accessories: none expression: surprised strength: empathy   weakness: easily bored,de261efe-731d-461e-b2e4-42edd2f48f72,8857c2d3b68fdb4d36fa6275f5c9945d9e52d4090d2eedf94bc0720010ba4629
,331,chifu-the-maasai,chifu the maasai,clothing inspired by maasai shuka,Male,hair: bald; eyes: closed teeth: none skin: none clothing: ankara shirt accessories: none expression: visionary strength:  authentic weakness: selfish,239933c4-7177-4b5b-86e8-e6f952301344,581964856000e1f535de0a2d70fb9f102e55e27533d71b31b177a191b8901f5f
,332,mwangaa-the-voice,mwangaa the voice,mwangaa the chief,Male,hair:  bald; eyes: blue teeth: none skin: darkskin clothing: white lined ankara accessories: none expression: kindness strength:  brave weakness: impatient,49179b62-812d-4d0f-b518-4af7fa79f8bc,d306bdae0fb5937c636fa730615fe9ec174772ede6b3d84d22aff5e76c07749e
,333,waforte-the-first,waforte the first,masked up man who does sleep a lot,Male,hair: bald; eyes: closedteeth:none skin: darkskin clothing: jean ankara accessories: none expression: shy strength:  weakness: selfish,871912a8-d96e-4594-b7b3-450d94ee6924,72c6eb792cdcab3ffc7fbd82be943ee8d32aa4ab61b4d913d41e2bf3feb8814d
,334,kariuki-the-prayerful-one,kariuki the prayerful one,kariuki closes his eyes,Male,hair: bald; eyes: closed eyes teeth: skin: clothing: accessories: expression: bored strength: intelligent  weakness: passive,6a5b6fa6-0f91-4b01-957f-c766945eb704,6bef1a94226a9c3f0447c48432132995daf347b33fdcbeef36e0b69be5e94d8e
,335,kenyanese-the-priest,kenyanese the priest,masked up man with with white cloth,Male,hair: bald; eyes: white teeth: none skin: darkskin clothing: white jean shirt accessories: none expression: calculative strength: kind weakness: takes things personally,0706c338-42eb-4d26-84ea-c24b39628200,58d1ce04d3c7ffe19770bd3ffccaeb663374fb1b3b9603dc35e26f106cf9cbc9
,336,nyimbo-the-singer,nyimbo the singer,glasses and a pot for the night,Female,hair:dreadlocks; eyes: glassed up teeth:none skin: brownskin clothing: off shoulder ankara accessories: a pot expression: free spirited strength: fair weakness: impatient,d05af807-b3e9-4ad3-8df1-b7864d2daa33,b4cbeecfb1539c483f3f05bbcb7745cefcffd2ca58039207171451effdb2d935
,337,maathai-the-nobel-winner,maathai the nobel winner,mathaai the warrior,Female,hair: pink afro; eyes: glassed up teeth: none skin: brownskin clothing: colored ankara accessories: noneexpression: strict strength: leadership  weakness:short sighted,0871cb8c-8d56-445d-92c7-01793f327707,cde603430e4571c8c2edde13bc8300555109ee93d2dafa54b8a464f7a3a7dbe0
,338,tish-the-angry-one,tish the angry one,angry tish with specs on,Female,hair: black huge afro; eyes:  none teeth: broken teeth skin: brownskin clothing: offshoulder ankara accessories: none expression: disgusted strength: blunt weakness:greedy,750a89dc-44ff-43bf-8211-b7776f1b5e52,381880d777d5ac3ce9e0641d06c4ced7de1851f06c8cfee758c9ad33ad62d19b
,339,wamenza-the-winner,wamenza the winner,wamenza the leader,Female,hair: laid back; eyes: none teeth: none skin: brownskin clothing: offshoulder ankara accessories: noneexpression: meditative strength: strict weakness: impulsive,7348c9ed-4ac9-4785-9434-0a1f0dcaf8d8,dc8d56f16326612cb4baea7d2c56cfc8d3c7d0f289ba4f9ceb1e7ea7026be870
,340,isaya-the-track-king,isaya the track king,isaya the traveller,Male,hair: none eyes: glassed up teeth: none skin: brown skin clothing: bright ankara accessories: none expression: taken aback strength: straight forward weakness: selfish,41781a16-d2b8-4fc6-a1f4-b9fffc5c95ba,782fdf436b5933b5e6ef89bc65f0ef24edd3e274a18ea055e17ae3b61eee317a
TEAM RULER,341,mansur-the-partyrider,mansur the partyrider,Mansur is the life of a party and never caught dulling.,Male,hair: none; eyes: ash grey; teeth: none;  clothing: agbda; accessories: studs; expression:happy; strength: intelligent; weakness: red whine,78db0f29-3936-4d9c-bb90-3dbf20dba2dd,ed2250b17be55b9ad4d7b1a5d924fbac27bb88664af75b49a41a84957392b3ac
,342,tola-the-businessman,tola the businessman,Tola loves business and owns several shops in Idumota.,Female,hair: none; eyes: midnightblack; teeth: none;  clothing: purple blowse; accessories: mask; expression:furious; strength: powerful; weakness: love,1c5d5a6b-cf04-4bf9-978e-22a7e9bc5819,cc3ea54477aa78cf71030b3366c0888ed9e39645f2d34885b23e43d3f57a64de
,343,abdullahi-the-honorable,abdullahi the honorable,"Popularly called ""buje budanu"" a godfather who lavishes money on young gees.",Male,hair: none; eyes: blue-blackish; teeth: none;  clothing: yoruba attire; accessories: none; expression:anxious; strength: foreseer; weakness:indecision,dd708276-445f-4483-8357-fc08e999328f,a144431997d74ffca89a8f130adea8a5758d33a433b37710aa8342757c33cc6b
,344,ojukwu-the-badguy,ojukwu the badguy,Ojukwu is a business minded guy but fun to be with.,Male,hair: bald; eyes: eagle eyeball; teeth: none;  clothing: yellow lining blowse; accessories: none; expression: none; strength: good eyes for fashion; weakness: lack will power,76c1eabf-15ea-446a-8426-472982c4d800,8cddc8ab37d5dbceaac0098a3452ed38b80a06fc586015de85a4a862f76ec4ae
,345,odunsi-the-egbonadugbo,odunsi the egbonadugbo,Odunsi loves to advise and people in the community rely on him.,Male,hair: none; eyes: dark brown; teeth: none; clothing: one shoulder gown; accessories: none; expression: none; strength: elegant; weakness: easily depressed,2912ab8b-5875-4277-a5c2-a0209aee90ae,9ca4b5853445118f1e50beb338beb6798f3bec4ae6733ea7d4ee5b2b8339cf7b
,346,ogogo-the-sugardaddy,ogogo the sugardaddy,A rich oil magnate who loves to solve young women's problems with his millions.,Male,hair: none; eyes: cat eyes; teeth: none; clothing: purple danshiki; accessories:nose mask; expression: straight face; strength: brave ; weakness: too selfless,aa575f30-04ad-45f9-a798-199465117793,251cfde78fa95f37e4d180896fd812abd9b091ebbf0da9974a66e5c0b29d3a85
,347,suli-the-amalaseller,suli the amalaseller,Suli sells amala with respect and people say that's the secret to her sweet food.,Female,hair: low punk; eyes: cat eyes; teeth: none; clothing:brown babarigai; accessories:none; expression: furious; strength: wealthy; weakness: too emotional,46fd4821-04dd-4f65-9290-c130a00c4c93,937ca6c74e4903ae879f108c43012adfb7cf0cc97057e37d2948fa79fe479abc
,348,dolapo-the-afrocentric,dolapo the afrocentric,Dolapo loves African prints and loves to showcase culture.,Female,hair:bald; eyes: brown; teeth: none; clothing: one sided blowse; accessories: nose mask; expression: none; strength: beautiful; weakness: forgetful,cbab232b-5c62-4df8-867b-018a2e496cd4,aa6d83013b10a6916f30c07cb2418ee9bd14be92d222912fbf010204defca541
,349,danjuma-the-saddist,danjuma-the-saddist,Danjuma is a grumpy man no one likes to associate with him.,Male,hair: none; eyes: sky blue; teeth: none; clothing:purple agbada; accessories: neck beads; expression: excited; strength: outspoken; weakness: boring,5a42af57-186e-425b-b6b1-f72bda4911ef,3ad993f1fb63889dde970ed484b2c83c20f9317df40b39f981b0b221be39ab82
,350,chinedu-the-farmer,chinedu the farmer,A hardworking farmer who has 6 boys who help out on the farm.,Male,hair: none; eyes: black; teeth: brown; clothing: one sided gown; accessories: none; expression: blushy; strength: easily loved; weakness: get angry easily,9e8a55d7-0d8d-465d-a628-08ddd387a2c6,762feaff7b672b164d653aa68a766422ac764d35fc470550682316959890bdf6
,351,kola-the-baldguy,kola the baldguy,Kola is every girls dream man because of his hair style.,Male,hair: low cut; eyes: mouse eyes; teeth: none; clothing: gbariye style; accessories: nose mask; expression: unhappy; strength: good eyes for details; weakness: sluggish,c32f1757-da9c-49e8-bd79-510a42b6971a,101774123a0051d05096bbb38bf89e5ca17209628f668ab250f705ca46a13cd7
,352,bola-the-bosslady,bola the bosslady,A lady who supports the boy child by providing scholarship to young talented males.,Female,hair: low cut; eyes: brown; teeth: none; clothing: short orange gown; accessories: nose mask; expression: none; strength: industrious; weaknes:spend lavishly,09ff910d-a2be-49d5-8b27-b9378458701c,480de32a2b9734ae666b3385a641c2fff5757f7845844b32d6edcafdde263f51
,353,kunle-the-alienguy,kunle the alienguy,Kunle is special and easily get noticed even in the midst of crowd.,Male,hair: green punk; eyes: green; teeth: none; clothing: purple agbada; accessories: purple beads; expression: unbothered; strength: very energetic; weaknes:eaaily give in,dea2f5d8-e3ba-4d3f-9a17-0a7edfd0c100,f983a421355c3408a5097761f19c373773d065472bb825cbc5bdd807dde6841d
,354,segun-the-sharp,segun the sharp,Segun drives with caution and people love him for that.,Male,hair: green punk; eyes: black ; teeth: none; clothing: orange buba; accessories: nose mask; expression: bitchy; strength: team player; weaknes: none,f9159a9c-f48d-4aee-bcc1-63c86209f806,8770bbb5c1b00c7f51bbff5828e0f5ceee490645eab77759bbcb1c7a822875e7
,355,ola-the-hardguy,ola the hardguy,Ola may be feared but he is such a coolheaded champ.,Male,hair: none; eyes: closed eyes; teeth: none; clothing: purple buba; accessories: none; expression: sick; strength: quick recovery power; weaknes: get ill frequently,a814fc77-bdfa-4e50-8ba8-3e4e4bcfb3c0,1c1f482d6442bc0f0a3b24aedbce749e50b8ba678ae65d9dfcf7ce93b8a547f6
,356,emeka-the-chief,emeka the chief,Crowd are always at Emeka's house because of his selflessness.,Male,hair: none; eyes: closed eyes; teeth: none; clothing: pakaja attire; accessories: none; expression: bossing; strength: easily comman respect; weaknes: not a ladies man,195e89c8-0b6f-43ad-9a2c-d20f03439e96,1c3d16326ee7026d05eeeffb8a66ba2f05a50c11f25004ab9072165c32ee3cf7
,357,ugochukwu-the-celeb,ugochukwu the celeb,Ugochukwu is an online celebrity with many followers on social media.,Male,hair: white blode; eyes: closed eyes; teeth: closed teeth; clothing: black gown; accessories: gold shades; expression: bitchy; strength: enterprising; weaknes: too emotional,74775cda-cff4-4d21-8819-693127598eca,138f016b31461ea07a24f0fa03ade00e1ef1731a37fb34d5d6c19af702925d94
,358,adekunle-the-yorubademon,adekunle the yoruba demon,He might be every woman's man but faithful and loyal to one.,Male,hair: gobi cap; eyes: closed eyes; teeth: closed teeth; clothing: ghana dansiki; accessories: gold shades; expression: owanbe mood; strength: from a walthy home; weaknes: disrespectful,5c98c2d8-3144-4e08-8a0f-9b8d7e4f5aa7,07e84aa18b1d5d0e7d5ca742e0ac28f451fb0e21330ef40bfac292b80e50ac9a
,359,favour-the-fashionista,favour the fashionista,Combining dresses is not a problem for Favour.,Female,hair: black ghana weaving; eyes: cat eyes; teeth: none; clothing: senegalese blowse; accessories: gold shades; expression: party rider; strength: smart; weaknes: lazy,19fc15c3-80fe-4d45-a2fe-be8f087d57c4,6aa1ccfa62c8bdef5020ebf68c0e6361aa5223bbf4dcda1053c2fda4627a1421
,360,jane-the-slayqueen,jane the slayqueen,Jane is always found in the midst of men and loves partying.,Female,hair: long grey braids; eyes: closed; teeth: black lips; clothing: black short gown; accessories: gold shades; expression: happy; strength:very intelligent; weaknes: have mood swings easily,74775cda-cff4-4d21-8819-693127598eca,e4bc1b238c26ca38b0a461a7d0f3cd3970cad55adbf93282069aba98f5e7bcc1
TEAM VBELT,361,osas-the-ceo,osas the ceo,Meet Osas; a Gen-Z CEO with the British accent.,Female,hair: purple dreadlocks;  eyes: none; teeth: none; clothing: danshiki;  accessories: gold glasses; expression: none; strength: none; weakness: none,b10f7e42-4778-49db-820b-dabbad75504a,e96dec2d9226d0c6d18ba683cc52913923011f86f9abc698558dc3038b97a978
,362,nneka-the-rainbow babe,nneka the rainbow babe,Nneka; the happy rainbow babe with the vibes.,Female,hair: pink;  eyes: none; teeth: none; clothing: blue and black bichrome; accessories: gold glasses; expression: none; strength: none; weakness: none,e7e20ab8-03e0-4e0a-80aa-6e193f84426e,5d34e1781edca2ee20fa34c2f9d73490437d2497bbababee617312b829982989
,363,temitope-the-spoilt girl,temitope the spoilt girl,Temitope; our favourite daddy's girl.,Female,hair: none; eyes: none; teeth: vampire teeth; clothing: right one-shoulder wax print; accessories: gold glasses; expression: none; strength: none; weakness: none,10cbcbcb-754e-4175-b85d-d0c7eafa16a2,59e952d2d3a41fef01b42f9edd5f55d2ce61665de54dd951a98d91660aa38601
,364,bekeh-the-party animal,bekeh the party animal,Baby Bekeh is life of the party that goes home with your charger.,Female,hair: dark brown;  eyes: none; teeth: none; clothing: left one-shoulder wax print; accessories: gold glasses; expression: none; strength: none; weakness: none,f0558235-3043-46e5-b26c-5bde83cc67fb,a5a5a189e9973d057cebed3cf49fc41f4be40749dc22f95393ee1631d4a69908
,365,nana-the-tech lady,nana the tech lady,Nana; the tech madam that doubles as Kumasi Adele in her bathroom every morning.,Female,hair: black; eyes: none; teeth: none; clothing: print kente;  accessories: gold glasses; expression: none; strength: none; weakness: none,e0858913-7050-4c4a-a2a0-442a88463334,746db69e743ccedea2be988bd21cbda34398e52b197780330fb6e862fc4aa2e6
,366,rofiat-the-marketer,rofiat the marketer,Rofiat; the distressed marketing intern.,Female,hair: purple dreadlocks; eyes: brown; teeth: none; clothing: danshiki; accessories: none; expression: none; strength: none; weakness: none,1e4d9bda-f6f9-4e7a-9381-bee4b074b56d,e29dd4253c0851ea6f4b81605df424b4094cd64ffafbb63d4c83940c17b8fc35
,367,zarifa-the-righteous,zarifa the righteous,Meet Zarifa; a proper baddie for Christ.,Female,hair: pink; eyes: blue; teeth: none; clothing: v-neck original kente; accessories: none;  expression: none; strength: none; weakness: none,c6955d16-c343-46bc-9bed-c069ea8cc65a,1a6a46757dd4c2ab2757a78afb5c0ee752471de744498d5d6691048ebc167c9c
,368,modinat-the-troublesome,modinat the troublesome,Modinat; The queen of gbas gbos.,Female,hair: long maroon hair; eye: none; teeth: vampire teeth; clothing: right one-shoulder wax print; accessories: brown glasses; expression: none; strength: none; weakness: none,49eb44e8-1117-463b-b7b3-1bcea4258362,5fcbff6eb469267db3ef3715573487e834212b751c33268b3e10fcee66b4d969
,369,amaka-our-mummy-g.o,amaka our mummy g.o,Here's Amaka; our one and only mummy G.O who's been to hell and back.,Female,hair: dark brown; eyes: blue; teeth: none; clothing: blue v-neck wax print; accessories: none; expression: none; strength: none; weakness: none,853edc40-0f9d-40c5-ba78-46067dfd7f68,cde6398950be814575bc4c89ccf2cea364d5ee982822374eac65d3ce3d0738c3
,370,mawusi-the-patient,mawusi the patient,Meet Mawusi; the sweet sister waiting for her Canadian bobo.,Female,hair: black; eyes: blue; teeth: none; clothing: print kente; accessories: beret; expression: none; strength: none; weakness: none,ca9ddc30-141a-493d-851b-71d34f599641,b869eb4ae13be2cb326fcd0828481b4cae0da5aaa6014461453c9e9da5bdd6e8
